{
  "schemaVersion": "1.0",
  "runId": "ff857590-904f-42d8-9618-7a45bdea33fc",
  "caseId": "SYNTH-001",
  "title": "Genetic consultation draft for clinical review",
  "summary": {
    "text": "This draft summarizes panel-based variant assessments for the childhood_epilepsy_v1 panel in a case referred for infantile-onset seizures and developmental delay, using the ClinVar (NCBI) release read at 2026-08-25T18:55:47.530048+00:00. [EV-001][EV-002]",
    "citations": [
      "EV-001",
      "EV-002"
    ]
  },
  "findings": [
    {
      "accession": "VCV003705313",
      "gene": "STXBP1",
      "clinicalSignificance": "Benign",
      "assessmentState": "classified",
      "statement": "The STXBP1 variant VCV003705313 was assessed as Benign in the release read, with review status 'criteria provided, single submitter'. [EV-003]",
      "citations": [
        "EV-003"
      ]
    },
    {
      "accession": "VCV004850844",
      "gene": "SCN2A",
      "clinicalSignificance": "Pathogenic",
      "assessmentState": "classified",
      "statement": "The SCN2A variant VCV004850844 was assessed as Pathogenic in the release read, with review status 'criteria provided, multiple submitters, no conflicts'. [EV-004]",
      "citations": [
        "EV-004"
      ]
    }
  ],
  "coverageStatement": {
    "text": "The childhood_epilepsy_v1 panel was applied and returned reference data for 8 genes; coverageState was panel_complete. [EV-002]",
    "citations": [
      "EV-002"
    ]
  },
  "limitations": [
    {
      "text": "This draft is limited to the case evidence supplied here, which includes panel coverage and the variant assessments from the ClinVar (NCBI) release read at 2026-08-25T18:55:47.530048+00:00. [EV-001][EV-002][EV-003][EV-004]",
      "citations": [
        "EV-001",
        "EV-002",
        "EV-003",
        "EV-004"
      ]
    },
    {
      "text": "The field-quality record lists no empty citable fields in this run. [EV-005]",
      "citations": [
        "EV-005"
      ]
    }
  ],
  "referenceRelease": {
    "text": "ClinVar (NCBI) release read at 2026-08-25T18:55:47.530048+00:00 for panel childhood_epilepsy_v1. [EV-001]",
    "citations": [
      "EV-001"
    ]
  },
  "reviewRequired": true,
  "disclaimer": "Automated draft generated from pipeline evidence for review by a qualified clinical genetics professional. It is not a diagnosis, not a clinical interpretation, and not a substitute for review of the primary data. All case data in this demonstration is synthetic."
}