{
  "schemaVersion": "1.0",
  "runId": "ff857590-904f-42d8-9618-7a45bdea33fc",
  "caseId": "SYNTH-004",
  "title": "Genetic consultation draft summary",
  "summary": {
    "text": "The childhood_epilepsy_v1 panel was read against the ClinVar (NCBI) reference release and returned 8 genes and 960 variant records in the referenced release [EV-001]. No variants are listed for this case, and the coverage record states that TSC1 was not covered on this panel [EV-002].",
    "citations": [
      "EV-001",
      "EV-002"
    ]
  },
  "findings": [],
  "coverageStatement": {
    "text": "The childhood_epilepsy_v1 panel was the test applied for this case [EV-002]. TSC1 was not examined on this panel, and no conclusion about TSC1 can be drawn from this result [EV-002].",
    "citations": [
      "EV-002"
    ]
  },
  "limitations": [
    {
      "text": "The report is limited to the genes returned on the childhood_epilepsy_v1 panel in the referenced ClinVar (NCBI) release [EV-001].",
      "citations": [
        "EV-001"
      ]
    },
    {
      "text": "The coverage record states that TSC1 was not covered, so this result does not provide a conclusion about that gene [EV-002].",
      "citations": [
        "EV-002"
      ]
    }
  ],
  "referenceRelease": {
    "text": "ClinVar (NCBI), read at 2026-08-25T18:55:47.530048+00:00 [EV-001].",
    "citations": [
      "EV-001"
    ]
  },
  "reviewRequired": true,
  "disclaimer": "Automated draft generated from pipeline evidence for review by a qualified clinical genetics professional. It is not a diagnosis, not a clinical interpretation, and not a substitute for review of the primary data. All case data in this demonstration is synthetic."
}